{
  "id": "8187ae0a-e8cf-4876-b00a-ae4f839de8bf",
  "personalName": "Mark, Barbara. Angelspeake book of prayer and healing. Spanish",
  "sftPersonalName": [
    "Mark, Barbara. Devocionario de su angel de la guarda"
  ],
  "saftPersonalName": [],
  "sftPersonalNameTitle": [],
  "saftPersonalNameTitle": [],
  "sftCorporateName": [],
  "saftCorporateName": [],
  "sftCorporateNameTitle": [],
  "saftCorporateNameTitle": [],
  "sftMeetingName": [],
  "saftMeetingName": [],
  "sftMeetingNameTitle": [],
  "saftMeetingNameTitle": [],
  "sftUniformTitle": [],
  "saftUniformTitle": [],
  "sftTopicalTerm": [],
  "saftTopicalTerm": [],
  "subjectHeadings": "c",
  "sftGeographicTerm": [],
  "saftGeographicTerm": [],
  "sftGenreTerm": [],
  "saftGenreTerm": [],
  "identifiers": [
    {
      "value": "877751",
      "identifierTypeId": "6051f95c-028e-4c6a-8a9e-ee689dd51453"
    },
    {
      "value": "n  97095655 ",
      "identifierTypeId": "e8b311a6-3b21-43f2-a269-dd9310cb2d0f"
    },
    {
      "value": "(DLC)n  97095655",
      "identifierTypeId": "e8b311a6-3b21-43f2-a269-dd9310cb2d0f"
    }
  ],
  "notes": []
}
